<?xml version="1.0" encoding="UTF-8"?>
<body
  xmlns:xsi="http://www.w3.org/2001/XMLSchema-instance"
  xmlns="https://github.com/francescozoccheddu/ambagi/src/schemas/body.xsd"
  xsi:schemaLocation="https://github.com/francescozoccheddu/ambagi/src/schemas/body.xsd ./../../schemas/body.xsd"
>
  <main>
    <paragraph>Ciao come va?</paragraph>
  </main>
  <footnotes>
    <footnote key="1ciao-come-v">
      <text>ciao come va <e>ciao</e></text>
    </footnote>
  </footnotes>
  <credits>
    <credit> Ciao sono un testo <e>ENFATIZZATO</e> qua e <e>LA</e>. </credit>
  </credits>
</body>